{
  "schema": "specgen/agent-workflow-compatibility/v1alpha1",
  "specgen_version": "0.2.11",
  "target": {
    "name": "agent-workflow",
    "product_version": "0.11.11",
    "source_snapshot": "b749dd71fdc1f41ce5e50f7e441dd4e88dd85a9c",
    "compatible_releases": [
      {
        "application": "agent-workflow",
        "application_version": "0.11.11",
        "source_snapshot": "b749dd71fdc1f41ce5e50f7e441dd4e88dd85a9c",
        "status": "verified",
        "contracts": [
          {
            "schema_id": "agent-workflow/prompt-pack/v1",
            "file": "0.11.11/schemas/pack.schema.json",
            "sha256": "b005325c6ac14f04be201ab5f56462237195c8f4f4a9130500cbb5e7fbb73c29",
            "status": "verified"
          },
          {
            "schema_id": "agent-workflow/evaluation-plan/v1",
            "file": "0.11.11/schemas/evaluation-plan.schema.json",
            "sha256": "074f706f16de4f8e0c352f8bba8b28ba20c567196c0be6e66028438e89bcf076",
            "status": "verified"
          },
          {
            "schema_id": "agent-workflow/source-baseline/v1",
            "file": "0.11.11/schemas/source-baseline.schema.json",
            "sha256": "da835fd07fae196f8d9dac396413e1c435725d0e1db0cb378ebab195b6609134",
            "status": "verified"
          },
          {
            "schema_id": "agent-workflow/agent-role/v1",
            "file": "0.11.11/schemas/agent-role-v1.schema.json",
            "sha256": "93aa44ceb71597e1a99a89e66135449a436673248749799d7ef25b6659c22de4",
            "status": "verified"
          },
          {
            "schema_id": "agent-workflow/task-result/v1",
            "file": "0.11.11/schemas/task-result.schema.json",
            "sha256": "f7ae2d01e8638c1d057e772befebc465e1501d1ddc49f0c03a54bf1b09b59810",
            "status": "verified"
          }
        ]
      },
      {
        "application": "agent-workflow",
        "application_version": "0.11.10",
        "source_snapshot": "811686d21b5fb4baca8c2790415a8a8eee84068a",
        "status": "verified",
        "contracts": [
          {
            "schema_id": "agent-workflow/prompt-pack/v1",
            "file": "0.11.10/schemas/pack.schema.json",
            "sha256": "b005325c6ac14f04be201ab5f56462237195c8f4f4a9130500cbb5e7fbb73c29",
            "status": "verified"
          },
          {
            "schema_id": "agent-workflow/evaluation-plan/v1",
            "file": "0.11.10/schemas/evaluation-plan.schema.json",
            "sha256": "571edfaadfb078bbeb11fae00422d89366887036bec23460884fc23e84a0ddee",
            "status": "verified"
          },
          {
            "schema_id": "agent-workflow/source-baseline/v1",
            "file": "0.11.10/schemas/source-baseline.schema.json",
            "sha256": "da835fd07fae196f8d9dac396413e1c435725d0e1db0cb378ebab195b6609134",
            "status": "verified"
          },
          {
            "schema_id": "agent-workflow/agent-role/v1",
            "file": "0.11.10/schemas/agent-role-v1.schema.json",
            "sha256": "93aa44ceb71597e1a99a89e66135449a436673248749799d7ef25b6659c22de4",
            "status": "verified"
          },
          {
            "schema_id": "agent-workflow/task-result/v1",
            "file": "0.11.10/schemas/task-result.schema.json",
            "sha256": "f7ae2d01e8638c1d057e772befebc465e1501d1ddc49f0c03a54bf1b09b59810",
            "status": "verified"
          }
        ]
      },
      {
        "application": "agent-workflow",
        "application_version": "0.11.9",
        "source_snapshot": "26c42c490d297d7d4a0f73038b431bc921b6e10e",
        "status": "verified",
        "contracts": [
          {
            "schema_id": "agent-workflow/prompt-pack/v1",
            "file": "0.11.9/schemas/pack.schema.json",
            "sha256": "b005325c6ac14f04be201ab5f56462237195c8f4f4a9130500cbb5e7fbb73c29",
            "status": "verified"
          },
          {
            "schema_id": "agent-workflow/evaluation-plan/v1",
            "file": "0.11.9/schemas/evaluation-plan.schema.json",
            "sha256": "571edfaadfb078bbeb11fae00422d89366887036bec23460884fc23e84a0ddee",
            "status": "verified"
          },
          {
            "schema_id": "agent-workflow/source-baseline/v1",
            "file": "0.11.9/schemas/source-baseline.schema.json",
            "sha256": "da835fd07fae196f8d9dac396413e1c435725d0e1db0cb378ebab195b6609134",
            "status": "verified"
          },
          {
            "schema_id": "agent-workflow/agent-role/v1",
            "file": "0.11.9/schemas/agent-role-v1.schema.json",
            "sha256": "93aa44ceb71597e1a99a89e66135449a436673248749799d7ef25b6659c22de4",
            "status": "verified"
          },
          {
            "schema_id": "agent-workflow/task-result/v1",
            "file": "0.11.9/schemas/task-result.schema.json",
            "sha256": "f7ae2d01e8638c1d057e772befebc465e1501d1ddc49f0c03a54bf1b09b59810",
            "status": "verified"
          }
        ]
      },
      {
        "application": "agent-workflow",
        "application_version": "0.11.8",
        "source_snapshot": "0ce21d068590e4d5a0822d91860d74e884c4e3f5",
        "status": "verified",
        "contracts": [
          {
            "schema_id": "agent-workflow/prompt-pack/v1",
            "file": "0.11.8/schemas/pack.schema.json",
            "sha256": "b005325c6ac14f04be201ab5f56462237195c8f4f4a9130500cbb5e7fbb73c29",
            "status": "verified"
          },
          {
            "schema_id": "agent-workflow/evaluation-plan/v1",
            "file": "0.11.8/schemas/evaluation-plan.schema.json",
            "sha256": "571edfaadfb078bbeb11fae00422d89366887036bec23460884fc23e84a0ddee",
            "status": "verified"
          },
          {
            "schema_id": "agent-workflow/source-baseline/v1",
            "file": "0.11.8/schemas/source-baseline.schema.json",
            "sha256": "da835fd07fae196f8d9dac396413e1c435725d0e1db0cb378ebab195b6609134",
            "status": "verified"
          },
          {
            "schema_id": "agent-workflow/agent-role/v1",
            "file": "0.11.8/schemas/agent-role-v1.schema.json",
            "sha256": "93aa44ceb71597e1a99a89e66135449a436673248749799d7ef25b6659c22de4",
            "status": "verified"
          },
          {
            "schema_id": "agent-workflow/task-result/v1",
            "file": "0.11.8/schemas/task-result.schema.json",
            "sha256": "f7ae2d01e8638c1d057e772befebc465e1501d1ddc49f0c03a54bf1b09b59810",
            "status": "verified"
          }
        ]
      },
      {
        "application": "agent-workflow",
        "application_version": "0.11.7",
        "source_snapshot": "c29f8871bd6e2902d4ca57f57a5ccf7dde71c877",
        "status": "verified",
        "contracts": [
          {
            "schema_id": "agent-workflow/prompt-pack/v1",
            "file": "0.11.7/schemas/pack.schema.json",
            "sha256": "b005325c6ac14f04be201ab5f56462237195c8f4f4a9130500cbb5e7fbb73c29",
            "status": "verified"
          },
          {
            "schema_id": "agent-workflow/evaluation-plan/v1",
            "file": "0.11.7/schemas/evaluation-plan.schema.json",
            "sha256": "571edfaadfb078bbeb11fae00422d89366887036bec23460884fc23e84a0ddee",
            "status": "verified"
          },
          {
            "schema_id": "agent-workflow/source-baseline/v1",
            "file": "0.11.7/schemas/source-baseline.schema.json",
            "sha256": "da835fd07fae196f8d9dac396413e1c435725d0e1db0cb378ebab195b6609134",
            "status": "verified"
          },
          {
            "schema_id": "agent-workflow/agent-role/v1",
            "file": "0.11.7/schemas/agent-role-v1.schema.json",
            "sha256": "93aa44ceb71597e1a99a89e66135449a436673248749799d7ef25b6659c22de4",
            "status": "verified"
          },
          {
            "schema_id": "agent-workflow/task-result/v1",
            "file": "0.11.7/schemas/task-result.schema.json",
            "sha256": "f7ae2d01e8638c1d057e772befebc465e1501d1ddc49f0c03a54bf1b09b59810",
            "status": "verified"
          }
        ]
      },
      {
        "application": "agent-workflow",
        "application_version": "0.11.6",
        "source_snapshot": "919a02ed07c81debd12dc804d234d9844a8a4281",
        "status": "verified",
        "contracts": [
          {
            "schema_id": "agent-workflow/prompt-pack/v1",
            "file": "0.11.6/schemas/pack.schema.json",
            "sha256": "b005325c6ac14f04be201ab5f56462237195c8f4f4a9130500cbb5e7fbb73c29",
            "status": "verified"
          },
          {
            "schema_id": "agent-workflow/evaluation-plan/v1",
            "file": "0.11.6/schemas/evaluation-plan.schema.json",
            "sha256": "571edfaadfb078bbeb11fae00422d89366887036bec23460884fc23e84a0ddee",
            "status": "verified"
          },
          {
            "schema_id": "agent-workflow/source-baseline/v1",
            "file": "0.11.6/schemas/source-baseline.schema.json",
            "sha256": "da835fd07fae196f8d9dac396413e1c435725d0e1db0cb378ebab195b6609134",
            "status": "verified"
          },
          {
            "schema_id": "agent-workflow/agent-role/v1",
            "file": "0.11.6/schemas/agent-role-v1.schema.json",
            "sha256": "93aa44ceb71597e1a99a89e66135449a436673248749799d7ef25b6659c22de4",
            "status": "verified"
          },
          {
            "schema_id": "agent-workflow/task-result/v1",
            "file": "0.11.6/schemas/task-result.schema.json",
            "sha256": "f7ae2d01e8638c1d057e772befebc465e1501d1ddc49f0c03a54bf1b09b59810",
            "status": "verified"
          }
        ]
      },
      {
        "application": "agent-workflow",
        "application_version": "0.11.5",
        "source_snapshot": "9ce90ea7857642af70bde32fab1f07292a7873f6",
        "status": "verified",
        "contracts": [
          {